{
  "questionSetVersion": "3.1.0",
  "executiveSet": [
    "SC-02",
    "SC-03",
    "SC-04",
    "SC-05",
    "SC-07",
    "VB-01",
    "VB-02",
    "UN-04",
    "UN-10",
    "UN-11",
    "QV-01",
    "QV-05",
    "OP-01",
    "OP-04",
    "OP-05",
    "OP-06",
    "MP-01",
    "MP-04",
    "HY-01",
    "HY-07"
  ],
  "questions": [
    {
      "id": "SC-01",
      "kind": "scope",
      "modes": [
        "workshop"
      ],
      "text": "Which best describes your infrastructure today?",
      "answerType": "single_select",
      "options": [
        {
          "value": "on_premises_only",
          "label": "On-premises only"
        },
        {
          "value": "mostly_dc",
          "label": "Mostly data centre"
        },
        {
          "value": "balanced_hybrid",
          "label": "Balanced hybrid"
        },
        {
          "value": "mostly_cloud",
          "label": "Mostly cloud"
        },
        {
          "value": "cloud_native",
          "label": "Cloud-native"
        },
        {
          "value": "unknown",
          "label": "Don't know"
        }
      ],
      "sets": [
        "footprint.infrastructureMix"
      ],
      "basis": [
        {
          "claimId": "CLM-FIN-006",
          "citation": "The FinOps Framework defines a Scope as a segment of technology spending (for example public cloud, SaaS, data centre, AI) that frames which personas, domains and capabilities apply [CLM-FIN-006]",
          "status": "V"
        },
        {
          "claimId": "CLM-FIN-164",
          "citation": "FinOps IQ v3 merged question set (LTM wording) [CLM-FIN-164]",
          "status": "LTM_heuristic"
        }
      ],
      "legacy": [
        {
          "id": "FVC.E1",
          "disposition": "kept",
          "note": "Workshop only; the executive mode infers the mix from SC-03"
        }
      ]
    },
    {
      "id": "SC-02",
      "kind": "scope",
      "modes": [
        "executive",
        "workshop"
      ],
      "text": "Which public cloud providers do you use or plan to use?",
      "answerType": "multi_select",
      "options": [
        {
          "value": "aws",
          "label": "AWS"
        },
        {
          "value": "azure",
          "label": "Azure"
        },
        {
          "value": "gcp",
          "label": "Google Cloud"
        },
        {
          "value": "oci",
          "label": "Oracle Cloud (OCI)"
        },
        {
          "value": "ibm",
          "label": "IBM Cloud"
        },
        {
          "value": "alibaba",
          "label": "Alibaba Cloud"
        },
        {
          "value": "other_public",
          "label": "Other public cloud"
        },
        {
          "value": "none_yet",
          "label": "None yet"
        }
      ],
      "sets": [
        "footprint.publicCloudProviders"
      ],
      "basis": [
        {
          "claimId": "CLM-FIN-006",
          "citation": "The FinOps Framework defines a Scope as a segment of technology spending (for example public cloud, SaaS, data centre, AI) that frames which personas, domains and capabilities apply [CLM-FIN-006]",
          "status": "V"
        },
        {
          "claimId": "CLM-FIN-120",
          "citation": "LTM complexity tier: points for in-scope annual spend (USD-equivalent, for tiering only: under 1M = 0, 1-10M = 1, 10-50M = 2, over 50M = 3), public cloud providers (2 = +1, 3 or more = +2), material Kubernetes (10%... [CLM-FIN-120]",
          "status": "LTM_heuristic"
        },
        {
          "claimId": "CLM-FIN-164",
          "citation": "FinOps IQ v3 merged question set (LTM wording) [CLM-FIN-164]",
          "status": "LTM_heuristic"
        }
      ],
      "legacy": [
        {
          "id": "FVC.E2",
          "disposition": "rewritten",
          "note": "Private or hosted cloud moves to SC-03 scopes; IBM and other providers added"
        }
      ]
    },
    {
      "id": "SC-03",
      "kind": "scope",
      "modes": [
        "executive",
        "workshop"
      ],
      "text": "Which of these are part of the spend you want FinOps to cover?",
      "help": "Public cloud is covered whenever a provider is selected in SC-02.",
      "answerType": "multi_select",
      "options": [
        {
          "value": "private_cloud",
          "label": "Private cloud"
        },
        {
          "value": "data_centre",
          "label": "Own data centre"
        },
        {
          "value": "colocation",
          "label": "Colocation"
        },
        {
          "value": "kubernetes",
          "label": "Kubernetes / containers"
        },
        {
          "value": "ai_api",
          "label": "AI APIs (tokens)"
        },
        {
          "value": "ai_platform_gpu",
          "label": "AI platforms or GPUs"
        },
        {
          "value": "saas",
          "label": "SaaS"
        },
        {
          "value": "licensing",
          "label": "Software licensing"
        },
        {
          "value": "data_cloud_platform",
          "label": "Data cloud platforms"
        }
      ],
      "sets": [
        "footprint.scopes"
      ],
      "basis": [
        {
          "claimId": "CLM-FIN-006",
          "citation": "The FinOps Framework defines a Scope as a segment of technology spending (for example public cloud, SaaS, data centre, AI) that frames which personas, domains and capabilities apply [CLM-FIN-006]",
          "status": "V"
        },
        {
          "claimId": "CLM-FIN-045",
          "citation": "State of FinOps 2026 (n = 1,192): nine in ten respondents (90%) are asked to manage SaaS spend, 64% software licensing and 48% data centre spend [CLM-FIN-045]",
          "status": "V"
        },
        {
          "claimId": "CLM-FIN-120",
          "citation": "LTM complexity tier: points for in-scope annual spend (USD-equivalent, for tiering only: under 1M = 0, 1-10M = 1, 10-50M = 2, over 50M = 3), public cloud providers (2 = +1, 3 or more = +2), material Kubernetes (10%... [CLM-FIN-120]",
          "status": "LTM_heuristic"
        },
        {
          "claimId": "CLM-FIN-164",
          "citation": "FinOps IQ v3 merged question set (LTM wording) [CLM-FIN-164]",
          "status": "LTM_heuristic"
        }
      ],
      "legacy": [
        {
          "id": "FVC.E2",
          "disposition": "rewritten",
          "note": "The private or hosted cloud option moves here as a scope"
        }
      ]
    },
    {
      "id": "SC-04",
      "kind": "scope",
      "modes": [
        "executive",
        "workshop"
      ],
      "text": "Roughly what is your annual spend in each of these areas, and in which currency?",
      "answerType": "matrix",
      "fields": [
        {
          "key": "row",
          "label": "Annual spend, one row per selected provider or scope",
          "type": "amount",
          "fact": "spend.byScope",
          "allowBand": true,
          "allowUnknown": true
        },
        {
          "key": "currency",
          "label": "Currency (ISO 4217)",
          "type": "select",
          "fact": "org.currency"
        }
      ],
      "sets": [
        "spend.byScope",
        "org.currency"
      ],
      "basis": [
        {
          "claimId": "CLM-FIN-120",
          "citation": "LTM complexity tier: points for in-scope annual spend (USD-equivalent, for tiering only: under 1M = 0, 1-10M = 1, 10-50M = 2, over 50M = 3), public cloud providers (2 = +1, 3 or more = +2), material Kubernetes (10%... [CLM-FIN-120]",
          "status": "LTM_heuristic"
        },
        {
          "claimId": "CLM-FIN-164",
          "citation": "FinOps IQ v3 merged question set (LTM wording) [CLM-FIN-164]",
          "status": "LTM_heuristic"
        }
      ],
      "legacy": [
        {
          "id": "FVC.E3",
          "disposition": "rewritten",
          "note": "One slider becomes spend by scope (exact, band or don't know) so levers have bases"
        }
      ]
    },
    {
      "id": "SC-05",
      "kind": "scope",
      "modes": [
        "executive",
        "workshop"
      ],
      "text": "How do you expect this spend to change over the next 12 months?",
      "answerType": "percent",
      "fields": [
        {
          "key": "growth",
          "label": "Percent change, -25 to +200",
          "type": "percent",
          "fact": "spend.growth12m",
          "allowUnknown": true
        }
      ],
      "sets": [
        "spend.growth12m"
      ],
      "basis": [
        {
          "claimId": "CLM-FIN-127",
          "citation": "LTM need verdict (executive mode only): need index 0-100 = mean over executive capabilities with a target of (gap / 3) x 100, with Unknown, and any capability with a question left blank, counted as the maximum gap... [CLM-FIN-127]",
          "status": "LTM_heuristic"
        },
        {
          "claimId": "CLM-FIN-139",
          "citation": "No spend growth is applied to value figures [CLM-FIN-139]",
          "status": "LTM_heuristic"
        },
        {
          "claimId": "CLM-FIN-164",
          "citation": "FinOps IQ v3 merged question set (LTM wording) [CLM-FIN-164]",
          "status": "LTM_heuristic"
        }
      ],
      "legacy": [
        {
          "id": "FVC.E5",
          "disposition": "kept"
        }
      ]
    },
    {
      "id": "SC-06",
      "kind": "scope",
      "modes": [
        "workshop"
      ],
      "text": "Where are you in moving workloads to cloud, and how much is still to move in the next 24 months?",
      "answerType": "compound",
      "fields": [
        {
          "key": "stage",
          "label": "Migration stage",
          "type": "select",
          "fact": "footprint.migration.stage",
          "allowUnknown": true,
          "options": [
            {
              "value": "planning",
              "label": "Planning"
            },
            {
              "value": "early",
              "label": "Early"
            },
            {